{
  "reviewer": "Test",
  "status": "approved",
  "snapshot_id": "2025-12-20T16-40-42-416Z.json",
  "timestamp": "2025-12-20T16:41:00.000Z",
  "items": [
    {
      "filename": "alpha.txt",
      "gtd_outcome": "trash",
      "sensitivity": "normal",
      "notes": ""
    },
    {
      "filename": "bravo.txt",
      "gtd_outcome": "next_action",
      "sensitivity": "normal",
      "notes": ""
    }
  ]
}